{
  "domain": "ai-film-rights",
  "kind": "roster",
  "version": 1,
  "generated_at": "2026-09-22",
  "stages": [
    "training",
    "city_brief",
    "blind_review",
    "screening",
    "incubation"
  ],
  "students": [
    {
      "id": "stu-001",
      "name": "林望舒",
      "major": "导演",
      "institution": "临港艺术学院",
      "team_id": "team-01",
      "status": "active",
      "enrolled_at": "2026-02-20"
    },
    {
      "id": "stu-002",
      "name": "陈既白",
      "major": "编剧",
      "institution": "北屿理工大学",
      "team_id": "team-01",
      "status": "active",
      "enrolled_at": "2026-02-20"
    },
    {
      "id": "stu-003",
      "name": "苏听澜",
      "major": "摄影",
      "institution": "汀洲传媒职业学院",
      "team_id": "team-01",
      "status": "withdrawn",
      "enrolled_at": "2026-02-20",
      "withdrawn_at": "2026-08-01"
    },
    {
      "id": "stu-004",
      "name": "叶照眠",
      "major": "编剧",
      "institution": "临港艺术学院",
      "team_id": "team-02",
      "status": "active",
      "enrolled_at": "2026-02-20"
    },
    {
      "id": "stu-005",
      "name": "沈叙白",
      "major": "摄影",
      "institution": "北屿理工大学",
      "team_id": "team-02",
      "status": "active",
      "enrolled_at": "2026-02-20"
    },
    {
      "id": "stu-006",
      "name": "顾栖迟",
      "major": "录音",
      "institution": "汀洲传媒职业学院",
      "team_id": "team-02",
      "status": "active",
      "enrolled_at": "2026-02-20"
    },
    {
      "id": "stu-007",
      "name": "江清晏",
      "major": "摄影",
      "institution": "临港艺术学院",
      "team_id": "team-03",
      "status": "active",
      "enrolled_at": "2026-02-20"
    },
    {
      "id": "stu-008",
      "name": "周星垂",
      "major": "录音",
      "institution": "北屿理工大学",
      "team_id": "team-03",
      "status": "active",
      "enrolled_at": "2026-02-20"
    },
    {
      "id": "stu-009",
      "name": "吴野阔",
      "major": "动画",
      "institution": "汀洲传媒职业学院",
      "team_id": "team-03",
      "status": "active",
      "enrolled_at": "2026-02-20"
    },
    {
      "id": "stu-010",
      "name": "郑云舟",
      "major": "录音",
      "institution": "临港艺术学院",
      "team_id": "team-04",
      "status": "active",
      "enrolled_at": "2026-02-20"
    },
    {
      "id": "stu-011",
      "name": "王雨眠",
      "major": "动画",
      "institution": "北屿理工大学",
      "team_id": "team-04",
      "status": "active",
      "enrolled_at": "2026-02-20"
    },
    {
      "id": "stu-012",
      "name": "李知夏",
      "major": "表演",
      "institution": "汀洲传媒职业学院",
      "team_id": "team-04",
      "status": "active",
      "enrolled_at": "2026-02-20"
    },
    {
      "id": "stu-013",
      "name": "张立冬",
      "major": "动画",
      "institution": "临港艺术学院",
      "team_id": "team-05",
      "status": "active",
      "enrolled_at": "2026-02-20"
    },
    {
      "id": "stu-014",
      "name": "刘惊蛰",
      "major": "表演",
      "institution": "北屿理工大学",
      "team_id": "team-05",
      "status": "active",
      "enrolled_at": "2026-02-20"
    },
    {
      "id": "stu-015",
      "name": "杨谷雨",
      "major": "美术",
      "institution": "汀洲传媒职业学院",
      "team_id": "team-05",
      "status": "active",
      "enrolled_at": "2026-02-20"
    },
    {
      "id": "stu-016",
      "name": "黄白露",
      "major": "表演",
      "institution": "临港艺术学院",
      "team_id": "team-06",
      "status": "active",
      "enrolled_at": "2026-02-20"
    },
    {
      "id": "stu-017",
      "name": "赵霜降",
      "major": "美术",
      "institution": "北屿理工大学",
      "team_id": "team-06",
      "status": "active",
      "enrolled_at": "2026-02-20"
    },
    {
      "id": "stu-018",
      "name": "许小雪",
      "major": "计算机",
      "institution": "汀洲传媒职业学院",
      "team_id": "team-06",
      "status": "active",
      "enrolled_at": "2026-02-20"
    },
    {
      "id": "stu-019",
      "name": "邓冬至",
      "major": "美术",
      "institution": "临港艺术学院",
      "team_id": "team-07",
      "status": "active",
      "enrolled_at": "2026-02-20"
    },
    {
      "id": "stu-020",
      "name": "韩夏至",
      "major": "计算机",
      "institution": "北屿理工大学",
      "team_id": "team-07",
      "status": "active",
      "enrolled_at": "2026-02-20"
    },
    {
      "id": "stu-021",
      "name": "曹春分",
      "major": "音乐",
      "institution": "汀洲传媒职业学院",
      "team_id": "team-07",
      "status": "active",
      "enrolled_at": "2026-02-20"
    },
    {
      "id": "stu-022",
      "name": "曾秋分",
      "major": "计算机",
      "institution": "临港艺术学院",
      "team_id": "team-08",
      "status": "active",
      "enrolled_at": "2026-02-20"
    },
    {
      "id": "stu-023",
      "name": "彭清明",
      "major": "音乐",
      "institution": "北屿理工大学",
      "team_id": "team-08",
      "status": "active",
      "enrolled_at": "2026-02-20"
    },
    {
      "id": "stu-024",
      "name": "萧芒种",
      "major": "制片",
      "institution": "汀洲传媒职业学院",
      "team_id": "team-08",
      "status": "active",
      "enrolled_at": "2026-02-20"
    },
    {
      "id": "stu-025",
      "name": "蔡小满",
      "major": "音乐",
      "institution": "临港艺术学院",
      "team_id": "team-09",
      "status": "active",
      "enrolled_at": "2026-02-20"
    },
    {
      "id": "stu-026",
      "name": "潘大暑",
      "major": "制片",
      "institution": "北屿理工大学",
      "team_id": "team-09",
      "status": "active",
      "enrolled_at": "2026-02-20"
    },
    {
      "id": "stu-027",
      "name": "袁处暑",
      "major": "导演",
      "institution": "汀洲传媒职业学院",
      "team_id": "team-09",
      "status": "active",
      "enrolled_at": "2026-02-20"
    },
    {
      "id": "stu-028",
      "name": "董寒露",
      "major": "制片",
      "institution": "临港艺术学院",
      "team_id": "team-10",
      "status": "active",
      "enrolled_at": "2026-02-20"
    },
    {
      "id": "stu-029",
      "name": "余立秋",
      "major": "导演",
      "institution": "北屿理工大学",
      "team_id": "team-10",
      "status": "active",
      "enrolled_at": "2026-02-20"
    },
    {
      "id": "stu-030",
      "name": "杜立春",
      "major": "编剧",
      "institution": "汀洲传媒职业学院",
      "team_id": "team-10",
      "status": "active",
      "enrolled_at": "2026-02-20"
    },
    {
      "id": "stu-031",
      "name": "程雨水",
      "major": "导演",
      "institution": "临港艺术学院",
      "team_id": "team-11",
      "status": "active",
      "enrolled_at": "2026-02-20"
    },
    {
      "id": "stu-032",
      "name": "陆小寒",
      "major": "编剧",
      "institution": "北屿理工大学",
      "team_id": "team-11",
      "status": "active",
      "enrolled_at": "2026-02-20"
    },
    {
      "id": "stu-033",
      "name": "侯小暑",
      "major": "摄影",
      "institution": "汀洲传媒职业学院",
      "team_id": "team-11",
      "status": "active",
      "enrolled_at": "2026-02-20"
    },
    {
      "id": "stu-034",
      "name": "孟沐阳",
      "major": "编剧",
      "institution": "临港艺术学院",
      "team_id": "team-12",
      "status": "active",
      "enrolled_at": "2026-02-20"
    },
    {
      "id": "stu-035",
      "name": "龙疏影",
      "major": "摄影",
      "institution": "北屿理工大学",
      "team_id": "team-12",
      "status": "active",
      "enrolled_at": "2026-02-20"
    },
    {
      "id": "stu-036",
      "name": "段横舟",
      "major": "录音",
      "institution": "汀洲传媒职业学院",
      "team_id": "team-12",
      "status": "active",
      "enrolled_at": "2026-02-20"
    },
    {
      "id": "stu-037",
      "name": "钱远山",
      "major": "摄影",
      "institution": "临港艺术学院",
      "team_id": "team-13",
      "status": "active",
      "enrolled_at": "2026-02-20"
    },
    {
      "id": "stu-038",
      "name": "汤近水",
      "major": "录音",
      "institution": "北屿理工大学",
      "team_id": "team-13",
      "status": "active",
      "enrolled_at": "2026-02-20"
    },
    {
      "id": "stu-039",
      "name": "尹朝歌",
      "major": "动画",
      "institution": "汀洲传媒职业学院",
      "team_id": "team-13",
      "status": "active",
      "enrolled_at": "2026-02-20"
    },
    {
      "id": "stu-040",
      "name": "黎拾遗",
      "major": "录音",
      "institution": "临港艺术学院",
      "team_id": "team-14",
      "status": "active",
      "enrolled_at": "2026-02-20"
    },
    {
      "id": "stu-041",
      "name": "易望舒",
      "major": "动画",
      "institution": "北屿理工大学",
      "team_id": "team-14",
      "status": "active",
      "enrolled_at": "2026-02-20"
    },
    {
      "id": "stu-042",
      "name": "常既白",
      "major": "表演",
      "institution": "汀洲传媒职业学院",
      "team_id": "team-14",
      "status": "active",
      "enrolled_at": "2026-02-20"
    },
    {
      "id": "stu-043",
      "name": "武听澜",
      "major": "动画",
      "institution": "临港艺术学院",
      "team_id": "team-15",
      "status": "active",
      "enrolled_at": "2026-02-20"
    },
    {
      "id": "stu-044",
      "name": "乔照眠",
      "major": "表演",
      "institution": "北屿理工大学",
      "team_id": "team-15",
      "status": "active",
      "enrolled_at": "2026-02-20"
    },
    {
      "id": "stu-045",
      "name": "贺叙白",
      "major": "美术",
      "institution": "汀洲传媒职业学院",
      "team_id": "team-15",
      "status": "active",
      "enrolled_at": "2026-02-20"
    },
    {
      "id": "stu-046",
      "name": "赖栖迟",
      "major": "表演",
      "institution": "临港艺术学院",
      "team_id": "team-16",
      "status": "active",
      "enrolled_at": "2026-02-20"
    },
    {
      "id": "stu-047",
      "name": "龚清晏",
      "major": "美术",
      "institution": "北屿理工大学",
      "team_id": "team-16",
      "status": "active",
      "enrolled_at": "2026-02-20"
    },
    {
      "id": "stu-048",
      "name": "文星垂",
      "major": "计算机",
      "institution": "汀洲传媒职业学院",
      "team_id": "team-16",
      "status": "active",
      "enrolled_at": "2026-02-20"
    },
    {
      "id": "stu-049",
      "name": "庞野阔",
      "major": "美术",
      "institution": "临港艺术学院",
      "team_id": "team-17",
      "status": "active",
      "enrolled_at": "2026-02-20"
    },
    {
      "id": "stu-050",